{
  "schema_version": 1,
  "suite_id": "mixed-benchmark-official-116-seed20260828",
  "active_benchmarks": [
    "locobench",
    "locabench",
    "gaia",
    "beyondswe"
  ],
  "description": "MIXED-BENCHMARK fixed-seed 116-case evolution protocol; held-out cases are supplied separately.",
  "ordering": {
    "strategy": "global_shuffle",
    "seed": 20260828,
    "round_unit": "one task per source benchmark",
    "shuffle_within_round": true,
    "shuffle_scope": "evolve",
    "materialized_order": true,
    "order_hash": "b6784c5eeec9b23061b8c28fb7ff52c9297a4ba9185e7d393283314acaace87e"
  },
  "shared_evolution": {
    "mode": "single_team_workspace",
    "team_name": "pool_EvoTeam",
    "state_root": "agents/pool_EvoTeam",
    "require_common_agent_namespace": true,
    "shared_artifacts": [
      "templates.json",
      "handoff_rules.json",
      "constitution.md",
      "pool.yaml",
      "*/evolution/prompt_patches.md",
      "*/evolution/teammate_profiles.yaml",
      "*/skills/**"
    ],
    "evolution_policy": {
      "evolve_phase": "sequential_updates_after_each_successfully_evaluated_task",
      "test_phase": "frozen_read_only_snapshot"
    }
  },
  "isolation_policy": {
    "selector_visible_fields": [
      "native_full_task",
      "normalized_collaboration_evidence",
      "family_catalog"
    ],
    "selector_hidden_fields": [
      "mixed_task_id",
      "source_benchmark",
      "source_split",
      "source_task_id",
      "source_index",
      "adapter_module",
      "native_evaluator",
      "hidden_annotations"
    ],
    "native_components": [
      "tool_environment",
      "task_construction",
      "output_contract",
      "artifact_collection",
      "evaluator"
    ],
    "score_policy": "retain_native_score_and_compute_cross-suite_metrics_only_during_aggregation"
  },
  "benchmark_bindings": {
    "locobench": {
      "adapter_module": "benchmarks.mixed_native.locobench_backend",
      "adapter_class": "LoCoBenchAdapter",
      "task_construction": "LoCoBenchAdapter.build_task",
      "native_environment": "isolated solution workspace and native scenario context",
      "execution_policy": "long_context_solution_workspace",
      "execution_policy_version": "1",
      "output_contract": "locobench_solution_summary",
      "submission_type": "solution_files_plus_completion_summary",
      "native_evaluator": "LoCoBenchAdapter.evaluate",
      "native_allowed_tools": [
        "read_file",
        "write_file",
        "bash"
      ]
    },
    "locabench": {
      "adapter_module": "benchmarks.mixed_native.locabench_backend",
      "adapter_class": "LOCABenchAdapter",
      "task_construction": "LOCABenchAdapter.build_task",
      "native_environment": "per-case LOCA MCP services and isolated local_db workspace",
      "execution_policy": "stateful_service_operations",
      "execution_policy_version": "2",
      "output_contract": "locabench_completion_summary",
      "submission_type": "verified_environment_state_plus_completion_summary",
      "native_evaluator": "LOCABenchAdapter.evaluate",
      "native_allowed_tools": [
        "read_file",
        "write_file",
        "bash",
        "loca_mcp"
      ]
    },
    "gaia": {
      "adapter_module": "benchmarks.mixed_native.gaia_backend",
      "adapter_class": "GAIAAdapter",
      "task_construction": "GAIAAdapter.build_task",
      "native_environment": "GAIA attachment workspace and retrieval tools",
      "execution_policy": "knowledge_question_with_optional_attachment",
      "execution_policy_version": "1",
      "output_contract": "gaia_short_answer",
      "submission_type": "strict_short_answer",
      "native_evaluator": "GAIAAdapter.evaluate",
      "native_allowed_tools": [
        "read_file",
        "write_file",
        "bash",
        "web_search",
        "web_fetch"
      ]
    },
    "beyondswe": {
      "adapter_module": "benchmarks.mixed_native.beyondswe_backend",
      "adapter_class": "BeyondSWEAdapter",
      "task_construction": "BeyondSWEAdapter.build_task",
      "native_environment": "per-case Docker repository environment",
      "execution_policy": "isolated_repository_patch",
      "execution_policy_version": "1",
      "output_contract": "beyondswe_patch_summary",
      "submission_type": "repository_patch_plus_fix_summary",
      "native_evaluator": "BeyondSWEAdapter.evaluate",
      "native_allowed_tools": [
        "read_file",
        "docker_bash",
        "docker_str_replace_editor"
      ]
    }
  },
  "tasks": [
    {
      "mixed_task_id": "mixed-evolve-052",
      "phase": "evolve",
      "order": 0,
      "source": {
        "benchmark": "locobench",
        "split": "python",
        "task_id": "python_blockchain_defi_easy_070_cross_file_refactoring_easy_01",
        "source_index": 12,
        "adapter_args": {
          "category": "cross_file_refactoring"
        }
      }
    },
    {
      "mixed_task_id": "mixed-evolve-018",
      "phase": "evolve",
      "order": 1,
      "source": {
        "benchmark": "gaia",
        "split": "train_20",
        "task_id": "983bba7c-c092-455f-b6c9-7857003d48fc",
        "source_index": 18,
        "adapter_args": {}
      }
    },
    {
      "mixed_task_id": "mixed-evolve-058",
      "phase": "evolve",
      "order": 2,
      "source": {
        "benchmark": "locobench",
        "split": "python",
        "task_id": "python_data_analytics_easy_082_cross_file_refactoring_expert_01",
        "source_index": 18,
        "adapter_args": {
          "category": "cross_file_refactoring"
        }
      }
    },
    {
      "mixed_task_id": "mixed-evolve-021",
      "phase": "evolve",
      "order": 3,
      "source": {
        "benchmark": "locobench",
        "split": "python",
        "task_id": "python_api_gateway_hard_009_feature_implementation_expert_01",
        "source_index": 1,
        "adapter_args": {
          "category": "feature_implementation"
        }
      }
    },
    {
      "mixed_task_id": "mixed-evolve-108",
      "phase": "evolve",
      "order": 4,
      "source": {
        "benchmark": "beyondswe",
        "split": "depmigrate",
        "task_id": "pydantic_pydantic-settings_pr55",
        "source_index": 12,
        "adapter_args": {}
      }
    },
    {
      "mixed_task_id": "mixed-evolve-105",
      "phase": "evolve",
      "order": 5,
      "source": {
        "benchmark": "beyondswe",
        "split": "depmigrate",
        "task_id": "tiangolo_fastapi_pr14186",
        "source_index": 9,
        "adapter_args": {}
      }
    },
    {
      "mixed_task_id": "mixed-evolve-107",
      "phase": "evolve",
      "order": 6,
      "source": {
        "benchmark": "beyondswe",
        "split": "depmigrate",
        "task_id": "narwhals-dev_narwhals_pr2958",
        "source_index": 11,
        "adapter_args": {}
      }
    },
    {
      "mixed_task_id": "mixed-evolve-095",
      "phase": "evolve",
      "order": 7,
      "source": {
        "benchmark": "beyondswe",
        "split": "crossrepo",
        "task_id": "cornices_cornice_pr271",
        "source_index": 19,
        "adapter_args": {}
      }
    },
    {
      "mixed_task_id": "mixed-evolve-017",
      "phase": "evolve",
      "order": 8,
      "source": {
        "benchmark": "gaia",
        "split": "train_20",
        "task_id": "384d0dd8-e8a4-4cfe-963c-d37f256e7662",
        "source_index": 17,
        "adapter_args": {}
      }
    },
    {
      "mixed_task_id": "mixed-evolve-012",
      "phase": "evolve",
      "order": 9,
      "source": {
        "benchmark": "gaia",
        "split": "train_20",
        "task_id": "33d8ea3b-6c6b-4ff1-803d-7e270dea8a57",
        "source_index": 12,
        "adapter_args": {}
      }
    },
    {
      "mixed_task_id": "mixed-evolve-086",
      "phase": "evolve",
      "order": 10,
      "source": {
        "benchmark": "beyondswe",
        "split": "crossrepo",
        "task_id": "pycqa_pyflakes_pr413",
        "source_index": 10,
        "adapter_args": {}
      }
    },
    {
      "mixed_task_id": "mixed-evolve-088",
      "phase": "evolve",
      "order": 11,
      "source": {
        "benchmark": "beyondswe",
        "split": "crossrepo",
        "task_id": "pylons_pyramid_pr2951",
        "source_index": 12,
        "adapter_args": {}
      }
    },
    {
      "mixed_task_id": "mixed-evolve-094",
      "phase": "evolve",
      "order": 12,
      "source": {
        "benchmark": "beyondswe",
        "split": "crossrepo",
        "task_id": "pylons_pyramid_pr1320",
        "source_index": 18,
        "adapter_args": {}
      }
    },
    {
      "mixed_task_id": "mixed-evolve-001",
      "phase": "evolve",
      "order": 13,
      "source": {
        "benchmark": "gaia",
        "split": "train_20",
        "task_id": "cffe0e32-c9a6-4c52-9877-78ceb4aaa9fb",
        "source_index": 1,
        "adapter_args": {}
      }
    },
    {
      "mixed_task_id": "mixed-evolve-026",
      "phase": "evolve",
      "order": 14,
      "source": {
        "benchmark": "locobench",
        "split": "python",
        "task_id": "python_api_microservice_expert_080_feature_implementation_hard_01",
        "source_index": 6,
        "adapter_args": {
          "category": "feature_implementation"
        }
      }
    },
    {
      "mixed_task_id": "mixed-evolve-092",
      "phase": "evolve",
      "order": 15,
      "source": {
        "benchmark": "beyondswe",
        "split": "crossrepo",
        "task_id": "diamondlightsource_python-workflows_pr76",
        "source_index": 16,
        "adapter_args": {}
      }
    },
    {
      "mixed_task_id": "mixed-evolve-067",
      "phase": "evolve",
      "order": 16,
      "source": {
        "benchmark": "locabench",
        "split": "evolve_96k",
        "task_id": "CourseAssistantS2LEnv_seed102",
        "source_index": 7,
        "adapter_args": {}
      }
    },
    {
      "mixed_task_id": "mixed-evolve-015",
      "phase": "evolve",
      "order": 17,
      "source": {